link,heading, intents, entities
/hc/en-us/articles/360000535825-Set-a-reminder-for-someone-else,Set a reminder for someone else, collaborating, reminder
/hc/en-us/articles/214085965-Share-a-project-with-all-its-sub-projects,Share a project with all its sub-projects, collaborating, share project
/hc/en-us/articles/209700245-Accept-project-invites-automatically,Accept project invites automatically, collaborating, project invites
/hc/en-us/articles/213640389-Assign-a-task-to-someone-else,Assign a task to someone else, collaborating, assign a task
/hc/en-us/articles/209430045-View-the-activity-log,View the activity log, collaborating, activity log
/hc/en-us/articles/214085945-Search-for-tasks-assigned-to-a-certain-person,Search for tasks assigned to a certain person, collaborating, someone elses tasks
