link,heading, intent, entities
/hc/en-us/articles/360012383099-Use-Butleroy-with-Todoist,Use Butleroy with Todoist, integrations, butleroy
/hc/en-us/articles/360012268960-Use-Apiant-with-Todoist,Use Apiant with Todoist, integrations, apiant
/hc/en-us/articles/360012380079-Use-DAKboard-with-Todoist-,Use DAKboard with Todoist, integrations, DAKboard
/hc/en-us/articles/360012126379-Use-Clockify-with-Todoist,Use Clockify with Todoist, integrations, Clockify
/hc/en-us/articles/360012043019-Use-Momentum-with-Todoist,Use Momentum with Todoist, integrations, Momentum
/hc/en-us/articles/115003128085-Use-Google-Calendar-with-Todoist,Use Google Calendar with Todoist, integrations, Google Calendar
/hc/en-us/articles/115004195289-Use-Gmail-with-Todoist,Use Gmail with Todoist, integrations, Gmail
/hc/en-us/articles/360010721059-Use-Amazon-Alexa-with-Todoist,Use Amazon Alexa with Todoist, integrations, Amazon Alexa
/hc/en-us/articles/360011914280-Use-Timeneye-with-Todoist,Use Timeneye with Todoist, integrations, Timeneye
/hc/en-us/articles/207659179-Use-Slack-with-Todoist,Use Slack with Todoist, integrations, Slack
/hc/en-us/articles/360000538429-Use-Todoist-with-Safari,Use Todoist with Safari, integrations, Safari
/hc/en-us/articles/360011881580-Use-Missive-with-Todoist,Use Missive with Todoist, integrations, Missive
/hc/en-us/articles/360011883459-Use-Klipfolio-with-Todoist,Use Klipfolio with Todoist, integrations, Klipfolio
/hc/en-us/articles/360011873379-Use-Integromat-with-Todoist,Use Integromat with Todoist, integrations, Integromat
/hc/en-us/articles/211493349-Use-Mailbird-with-Todoist,Use Mailbird with Todoist, integrations, Mailbird
/hc/en-us/articles/212102645-Use-Toggl-with-Todoist,Use Toggl with Todoist, integrations, Toogl
/hc/en-us/articles/360000632460-How-can-I-use-Todoist-with-Pleexy-,How can I use Todoist with Pleexy?, integrations, Pleexy
/hc/en-us/articles/360000021600-How-can-I-use-Todoist-with-Spark-,How can I use Todoist with Spark?, integrations, Spark
/hc/en-us/articles/360003132099-How-can-I-use-Todoist-with-Mailbutler-,How can I use Todoist with Mailbutler?, integrations, Mailbutler
/hc/en-us/articles/360000388285-How-can-I-use-Todoist-with-Outlook-,How can I use Todoist with Outlook?, integrations, Outlook
/hc/en-us/articles/360000538389-How-can-I-use-the-Todoist-for-Firefox-extension-,How can I use the Todoist for Firefox extension?, integrations, Firefox extension
/hc/en-us/articles/360000538309-How-can-I-use-the-Todoist-for-Google-Chrome-extension-,How can I use the Todoist for Google Chrome extension?, integrations, Google Extenstion
/hc/en-us/articles/115005663189-How-can-I-use-Todoist-with-Flat-Tomato-,How can I use Todoist with Flat Tomato?, integrations, Flat Tomato
/hc/en-us/articles/212366769-How-can-I-use-Todoist-with-Timely-,How can I use Todoist with Timely?, integrations, Timely
/hc/en-us/articles/115000771309-Use-Scanbot-with-Todoist,Use Scanbot with Todoist, integrations, Scanbot
/hc/en-us/articles/207716529-How-can-I-use-Todoist-with-Zapier-,How can I use Todoist with Zapier?, integrations, Zapier
/hc/en-us/articles/115000378825-How-can-I-use-Todoist-with-TMetric-,How can I use Todoist with TMetric?, integrations, TMetric
/hc/en-us/articles/211494189-How-can-I-use-Todoist-with-Powr-of-You-,How can I use Todoist with Powr of You?, integrations, Powr of You
/hc/en-us/articles/206522639-How-can-I-use-Todoist-with-Apple-Mail-,How can I use Todoist with Apple Mail?, integrations, Apple Mail
/hc/en-us/articles/211495809-How-can-I-use-Todoist-with-TaskClone-,How can I use Todoist with TaskClone?, integrations, TaskClone
