link,heading,intent,entities
/hc/en-us/articles/360010423280-What-happens-when-I-remove-a-Business-user-,What happens when I remove a Business user?
/hc/en-us/articles/360000535965-Make-someone-an-admin-of-your-Todoist-Business-account,Make someone an admin of your Todoist Business account
/hc/en-us/articles/360000538829-Remove-people-from-your-Todoist-Business-account,Remove people from your Todoist Business account
/hc/en-us/articles/360000538789-Invite-people-to-your-Todoist-Business-account,Invite people to your Todoist Business account
/hc/en-us/articles/205248822-What-s-the-difference-between-Premium-and-Business-,What’s the difference between Premium and Business?
/hc/en-us/articles/205303321-Switch-from-Free-Premium-to-Business,Switch from Free/Premium to Business
